{
  "id": "SEC-001",
  "title": "Example only \u2014 do not treat as a real finding",
  "severity": "MEDIUM",
  "confidence": "Low",
  "status": "UNVERIFIED",
  "category": "example",
  "affected_file": "example.ts",
  "location": "1:1",
  "entry_point": "example",
  "reachability": "UNVERIFIED",
  "attacker_controlled_input": "UNVERIFIED",
  "trust_boundary": "UNVERIFIED",
  "validation": "UNVERIFIED",
  "authentication": "UNVERIFIED",
  "authorization": "UNVERIFIED",
  "dangerous_sink": "UNVERIFIED",
  "exploit_path": "Not established",
  "impact": "Not established",
  "evidence": [],
  "existing_mitigations": [],
  "why_mitigation_is_insufficient": "Not established",
  "minimal_remediation": "Do not remediate example data.",
  "verification": [],
  "source_evidence": [],
  "limitations": [
    "Illustrative schema example only."
  ]
}
